{
  "$manifest": {
    "version": "1.0.0",
    "contentHash": "sha256:a1b2c3d4e5f6789012345678901234567890123456789012345678901234abcd",
    "createdAt": "2024-01-15T11:00:00.000Z",
    "lineage": {
      "root": "sha256:a1b2c3d4e5f6789012345678901234567890123456789012345678901234abcd",
      "parent": null,
      "depth": 0
    }
  },
  "id": "660e8400-e29b-41d4-a716-446655440010",
  "departmentId": "550e8400-e29b-41d4-a716-446655440002",
  "name": "Platform Infrastructure",
  "function": "infrastructure",
  "headcount": 12,
  "observedAt": "2024-01-15T11:00:00.000Z",
  "dataSource": {
    "type": "hr-system",
    "identifier": "workday-instance-prod",
    "extractedAt": "2024-01-15T10:45:00.000Z"
  },
  "systemOwnerships": [
    {
      "systemId": "770e8400-e29b-41d4-a716-446655440020",
      "ownershipType": "primary",
      "since": "2023-06-01T00:00:00.000Z"
    },
    {
      "systemId": "770e8400-e29b-41d4-a716-446655440021",
      "ownershipType": "secondary",
      "since": "2023-09-15T00:00:00.000Z"
    }
  ]
}
